<?xml version="1.0" encoding="UTF-8"?>
<xs:schema xmlns:xs="http://www.w3.org/2001/XMLSchema">

    <!-- Root element -->
    <xs:element name="employees">
        <xs:complexType>
            <xs:sequence>
                <xs:element name="employee" maxOccurs="unbounded">
                    <xs:complexType>
                        <xs:sequence>
                            <xs:element name="id" type="xs:integer"/>
                            <xs:element name="name" type="xs:string"/>
                            <xs:element name="email" type="xs:string"/>
                            <xs:element name="phone" type="xs:string"/>
                            <xs:element name="department" type="xs:string"/>
                        </xs:sequence>
                    </xs:complexType>
                </xs:element>
            </xs:sequence>
        </xs:complexType>
    </xs:element>

</xs:schema>
